"text","SVM_LABEL","SVM_PROB","original_text","lon","lat","state"
"club newark nj tco frwyrpq","2",0.824856707799983,"I'm at @United Club in Newark, NJ https://t.co/8fRWYRp0q1",NA,NA,NA
"sorri luci realli get shit togeth seem good luck edefbf","1",0.641363833764727,"@Lucie_Pepe_ @united I'm so sorry, Lucie! They really can't get their shit together it seems. Good luck! <U+2764><U+FE0F>",-74.0868095,41.7475933,"new york"
"haha get son","2",0.644584409535024,"@MCSerch @united haha get them son",-74.0059413,40.7127837,"new york"
"rt know answer passeng ve given seat voluntarili unitedairlin re","1",0.974039466344243,"RT @Amour_Beignets: If only @united knows @pepsi is the answer, #Passengers would've given up their seats \"voluntarily\". #unitedAIRLINES #R<U+2026>",NA,NA,NA
"look much room relax take note tco nlulmyji","2",0.614234045069876,"Look at how much room and relaxed it was! @united @Delta @AmericanAir @SouthwestAir take note! https://t.co/NlUl6m2yjI",-75.1652215,39.9525839,"pennsylvania"
"fli unit noth will chang one year will back te tco opzztgkzt","1",0.963753157644573,"@AylinSerce_ @HilalKirmizi_ I wouldn't fly United. Nothing will change from them in one year they will be back to t<U+2026> https://t.co/O7pzzTgkzT",-73.9712488,40.7830603,"new york"
"new airlin complaint miss job interview customerservic pleas respond now tco ocwrskblk","1",0.542901635398673,"New @United Airlines #Complaint \"I MISSED MY JOB INTERVIEW\" #Customerservice please respond now at https://t.co/OCWrSKbLk0",-74.0059413,40.7127837,"new york"
"flight leav min even start board yet wait flight attend realli unitedairlin","1",0.968093396941077,"Our flight leaves in 15mins and we haven't even started boarding yet. Waiting on flight attendant. Really #UnitedAirlines?! @united",-74.0059413,40.7127837,"new york"
"hell board flight ahead schedul time departur delay min late min sit still u suck","1",0.989483159955477,".@united why the hell board a flight 45 ahead of scheduled time if departure is delayed by 30 min late? That's 75 min sitting still! U suck!",-73.9841699,40.7599872,"new york"
"lhr ewr sound like ingrat u promot app entertain work right","1",0.68785036159417,"@united #LHR to #EWR not to sound like an ingrate, but if u promote app entertainment, should work, right?",-73.134961,40.789142,"new york"
"s safeti video just see bagpip llama beach wed costum","2",0.966896303220705,"@united's safety video - what did I just see?? Bagpipes, llamas, beach wedding, costumes?",-74.0059413,40.7127837,"new york"
"fight club tho","1",0.591887546130722,"@united Is there a fight Club tho???",-73.8648268,40.8447819,"new york"
"need keep rest fli ny geneva dinosaur plane staralli tco zmkfwqpzcm","1",0.964967651466244,"@united needs to keep up with the rest of @staralliance ! Flying NY to Geneva on a dinosaur plane. #StarAlliance https://t.co/zMkFwqPZcM",-74.0059413,40.7127837,"new york"
"good morn flight friend avgeek travel tco jewybxptfg","2",0.714258309669496,"Good morning from this @united flight, @AmericanAir and @SouthwestAir friends! #avgeek #travel https://t.co/jewYbXptfG",-73.087749,41.6032207,"connecticut"
"termin oscarmunoz","1",0.517692915987171,"@ShaunKing why does it have to be @united terminal,where is #oscarmunoz",-74.0059413,40.7127837,"new york"
"club newark nj tco puctrpxti","2",0.824856707799983,"I'm at @United Club in Newark, NJ https://t.co/pUCtRp0xtI",-73.9565551,40.7735649,"new york"
"ad board nice flight even surpris nice singl malt scotch avail","1",0.836127791040163,"@united AD once on board it was a nice flight. Even a surprisingly nice single  malt Scotch was available :)",-74.0059413,40.7127837,"new york"
"yes ad got board walk long way wrong direct biggi just puzzl","1",0.798391459578735,"@united Yes AD got on board but walked a long way in the wrong direction. No biggie just puzzling.",-74.0059413,40.7127837,"new york"
"flight reboot entertain system crash linux pathet tco xqzrfeggk","1",0.938690516622694,"When your @united flight reboots all their entertainment systems because they've all crashed.  #linux #pathetic https://t.co/3xqzRFeGgK",-74.0059413,40.7127837,"new york"
"f exit row paid extra zero room savag absurd","1",0.79505354718338,"@united I'm in 21F - exit row, paid $125 extra - and there's zero room. This is savage and absurd.",-74.0059413,40.7127837,"new york"
"damn happen","1",0.800172796043398,"@MCSerch @united Damn, what happened??",-74.0059413,40.7127837,"new york"
"hey wonder passeng rebel treat us like chicken factori farm head slaughter","2",0.553421845028259,"Hey @united, no wonder your passengers rebelled. You treat us like chickens on a factory farm headed to slaughter.",-74.0059413,40.7127837,"new york"
"rt hrs incred vagu mislead answer ppl flight deserv refund","1",0.611570071741884,"RT @alanabeans: @united 9 hrs. of incredibly vague and misleading answers. All of the ppl on flight 219 deserve a refund and then some.",NA,NA,NA
"hrs incred vagu mislead answer ppl flight deserv refund","1",0.611570071741884,"@united 9 hrs. of incredibly vague and misleading answers. All of the ppl on flight 219 deserve a refund and then some.",-74.0868095,41.7475933,"new york"
"stuck airport hrs redirect ca hi","1",0.974175856064564,"@united Stuck in the airport for 9 hrs. after being redirected to CA from HI",-74.0868095,41.7475933,"new york"
"rt ya know go suck gave anoth chanc sorri say grrrrrr worstcustomerservic badattitu","1",0.986734565484886,"RT @ellynsworld: Ya know what @united , go suck it. I gave you another chance sorry to say. GRRRRRR....... #worstcustomerservice #badattitu<U+2026>",NA,NA,NA
"rt unitedairlin thank great custom servic drag custom flight now boy","2",0.505142889779209,"RT @myglittershines: #unitedAIRLINES @united thanks to your great customer service, of dragging customers off your flights. You are now boy<U+2026>",NA,NA,NA
"just appreci gate agent luggag handler friend respect valid passeng concern","1",0.795150466841476,"@united would just appreciate gate agents and luggage handlers being more friendly and respectful of valid passenger concerns.",-74.0059413,40.7127837,"new york"
"rt mayb airlin learn thing tco ebryzag","2",0.790524386034074,"RT @Your_Daily_Dish: Maybe @United Airlines could learn a thing or too from @SouthwestAir https://t.co/1EBRy2z8aG",NA,NA,NA
"minut late far time departur smh","1",0.830044255616133,"@united 35 minutes  late so far and no time of departure, smh",-74.1500469,40.7936744,"new jersey"
"first compliment well complain deserv sfo win realli great experi well earn thank","2",0.999999856006386,"First to compliment (as well as complain) when deserved.  @united SFO for the WIN!!!  Really a great experience. A well earned THANK YOU!",-75.1652215,39.9525839,"pennsylvania"
"unitedairlin basic economi oxymoron good sign airlin learnt noth dragthemoff tco fammbnam","1",0.909429135790669,"#unitedAIRLINES basic economy is not only oxymoronic, it's a good sign the airline has learnt nothing #dragthemoff<U+2026> https://t.co/f4a6mmBNAM",-74.0059413,40.7127837,"new york"
"unit airlin drag passeng charg militari overweight baggag shame te tco udhbsr","1",0.569731571018433,"@dsshep1959 @united United Airline dragging passengers off charging our Military for overweight baggaged shame on t<U+2026> https://t.co/uDH400BsR2",-81.5157535,27.6648274,"florida"
"littl girl atlant ocean flight crew helm capabl hand","1",0.713092308303769,"my little girl is in a @Boeing 787 over the Atlantic Ocean with a @united flight crew at the helm.. She's in very capable hands.",-74.4056612,40.0583238,"new jersey"
"sigh good tco dniduhni","2",0.750945349871794,"Sigh this is not good @united https://t.co/dNIdUhN82I",-74.0059413,40.7127837,"new york"
"hey can pleas rate first class meal flight today tco jbofeopsex","1",0.518319751905284,"Hey @GordonRamsay can you please rate this First Class meal from my @united flight today??? https://t.co/JBOFeOPseX",-73.9842724,40.715033,"new york"
"hand","1",0.55635235587892,"she's in your hands @united",-74.4056612,40.0583238,"new jersey"
"feel limber client event tomorrow given ft stature tco umiseondfl","1",0.932190482371526,"@borislogvinskiy @united You should be feeling very limber for our client event tomorrow , given your 6+ ft stature<U+2026> https://t.co/uMiSEONDfL",-74.0059413,40.7127837,"new york"
"just keep screw us ruthless tco lpobgobuau","2",0.596659553456039,"@United_Airline @united  you just keep screwing us!! You are ruthless!! https://t.co/lpOBgObuaU",-73.9939285,40.7452939,"new york"
"dare unit airlin charg militari personnel bag overweight e tco ysuznvxur","2",0.543614397135481,"@united @Modrnlve How dare you United Airline charging a military personnel $200 because bags are overweight you're<U+2026> https://t.co/YSuZ1NvXUr",-81.5157535,27.6648274,"florida"
"credit due eb team follow dilig resolut yet good social media follow","1",0.533409031071643,"Credit where it's due. EB from the @united team has followed up diligently. No resolution yet, but good social media follow up",NA,NA,NA
"unbeliev self ecer time now never ed tco nghhap","2",0.609812729433361,"Unbelievable self-own by @united. <U+201C>We<U+2019>re not on time now, but we never have been!<U+201D> https://t.co/NG58hh0aP5",NA,NA,NA
"worst lol flew american last time bf usual unit suck actual wors","1",0.99208388621923,"@caitlinmaaariex @united They're all the worst lol we flew american last time bf usually united sucks but it was actually worse !",-74.0059413,40.7127837,"new york"
"rt hr delay check carryon entir plane sent carousel ewr thank screw unit une","2",0.633021334061089,"RT @arx147: 3-hr delay, then all checked carry-ons (entire plane) sent to carousel at EWR. Thanks for screwing me again @united #united #un<U+2026>",-74.0059413,40.7127837,"new york"
"welcom world thank care","2",0.930138375039467,"@Joy_Villa @united Welcome to my world. Thank you for caring....",-74.0059413,40.7127837,"new york"
"realli charg tv disappoint tco jyehxtjri","1",0.60453985951716,"Really @united? Charging for TV? #disappointed https://t.co/JYehxT5jry",-74.0059413,40.7127837,"new york"
"bring wide brim hat sunblock forget put sunblock","1",0.565277245555956,"@borislogvinskiy @united Did you bring your wide brimmed hat and sunblock? Don't forget to put the sunblock on.",-73.9441579,40.6781784,"new york"
"plan respond dm ask send","1",0.982876004214691,"@united any plans to respond to the DM you asked me to send?",NA,NA,NA
"care get reaccommod","1",0.750950593247101,"@Katie_Roof @united Careful!

You'll get reaccommodated!!!

;)",-74.0059413,40.7127837,"new york"
"put head","1",0.60819295037905,"@howardlindzon @united You put it on your head",-75.1652215,39.9525839,"pennsylvania"
"least react quick","2",0.680251412761318,"@united At least you reacted quickly",NA,NA,NA
"wheelchair bound travel expos level amount abus notlearn","1",0.740157752076521,"@united wheelchair bound travelers should not be exposed to this level of what amounted to abuse #notlearning 3/3",NA,NA,NA
"rude check staff flexibl special assist desk staf talk travel poorservic","1",0.959709431276938,"@united rude check in staff, no flexibility, all while special assistance desks were staffed but not talking to travelers 2/3 #poorservice",NA,NA,NA
"elder motherlaw stress check newark basic prevent speak special assist fail","1",0.97226072754743,"@united Elderly Mother-in-Law had the most stressful check-in at Newark basically prevented from speaking to 'special assistance' #fail 1/3",NA,NA,NA
"thank delay flight denver truli appreci time today want new jersey","2",0.991995935287913,"Thank you @united for the delays in flights for Denver... truly don't appreciate it. 3 times today. I want out of New Jersey...",-104.8319195,39.7294319,"colorado"
"rt new troubl tco xiolkxd","2",0.581628330131266,"RT @JesseRodriguez: New trouble for @united https://t.co/0xiolkx6D6",-81.5157535,27.6648274,"florida"
"tv free wifi min wait tarmac awesom xcountri flight","2",0.705345192561229,"No #tv, no free #wifi and a 45 min wait on the tarmac. Awesome x-country flight @united.",-74.0059413,40.7127837,"new york"
"hey point arriv earli sit tarmac min find gate tortur","1",0.798913189200976,"Hey @united @flySFO what's the point of arriving early when we have to sit on the tarmac for 45 min to find a gate? #torture",-74.0059413,40.7127837,"new york"
"found best thing flight take amtrak instead world amtrak better fli","2",0.686283475034421,"@united found out the best thing to do with your flights. Take Amtrak instead. In what world is Amtrak better than flying?",-74.0059413,40.7127837,"new york"
"rt hey goe like admit error make amend announc polici chang stop happen have","1",0.969251365925317,"RT @rkylesmith: Hey @united, it goes like this:
1) Admit error
2) Make amends
3) Announce policy change to stop it happening again.
You hav<U+2026>",-122.8037102,45.487062,"oregon"
"thank asian vegetarian meal london awesom tco rjqfpvf","2",0.992896796173733,"Thanks @United Asian Vegetarian meal  from London is awesome https://t.co/4R7jQf5pVF",-74.2090053,40.8259007,"new jersey"
"rt s new board procedur pretti brtal tco kgothnz","2",0.670431741257709,"RT @metalinjection: .@United's new boarding procedure is pretty br00tal. https://t.co/K8GOtH3Nz9",NA,NA,NA
"join forc guess leav link yeah make sens skymil platinummedallion","1",0.99162088901411,"With @lyft and @Delta joining forces I guess that leaves @united and @Uber to link up? Yeah, that makes sense. #Skymiles #PlatinumMedallion",-74.0059413,40.7127837,"new york"
"yes good deliv morn sure happen thx","2",0.694981879771185,"@united Yes all good, they delivered it this morning. Not sure how that happened.  Thx",NA,NA,NA
"answer question","1",0.654760140208477,"@united That doesn't answer my question.",-74.0059413,40.7127837,"new york"
"servic excel nicest person","2",0.990042316161966,"@united His service was excellent, and he was the nicest person.",-74.0059413,40.7127837,"new york"
"fa corey ua last night amaz kind person id want get coffe earth pleas pass compiment","2",0.905929313406826,"@united FA Corey on UA331 last night was amazing. The kind of person Id want to get coffee with, so down to earth. Please pass on compiment.",-74.0059413,40.7127837,"new york"
"serious tco iffcojwk associ chat client disabl stream video","1",0.604573383789826,"@united Seriously. Why is https://t.co/I5ffcOJw3k and the associated chat client disabled. This is not streaming video.",-74.0059413,40.7127837,"new york"
"rt woman also refus give seat tco ltlemxv","1",0.828297979915576,"RT @AlamoNYC: This woman also refused to give up her seat on @united https://t.co/lT67LeMxVE",NA,NA,NA
"flight beij readi push back gate travel lovetravel","1",0.749078919290244,"My @united flight to Beijing is ready to push back from the gate! #travel #lovetravel",-74.0059413,40.7127837,"new york"
"fli friend sky","2",0.550076561703378,"@TheSportsHernia @united You fly the Friendly Skies?",-74.4056612,40.0583238,"new jersey"
"convers continu provid phone servic time hope explanatio tco itgqravtb","1",0.761923371030867,"@AmandaBrandow @united Conversation continues, \"We do not provide phone service at this time, I hope the explanatio<U+2026> https://t.co/itGQr6Avtb",-73.9441579,40.6781784,"new york"
"loyal diamond kudo today let gf check lb bag rather carri item china manner","2",0.615016094334586,"While I'm a loyal @delta diamond, kudos to @united today. They let my gf check a 54 lb bag rather than carry-on more items to China #manners",-73.9910835,40.7358633,"new york"
"rt gate natur tco ehsetddm","1",0.521461120942657,"RT @heyphilchang: At a @united gate, naturally https://t.co/EhsET1DDme",-74.0059413,40.7127837,"new york"
"rt say will took like four tri two day releas apolog e","1",0.767184862874225,"RT @marshallpritt: @nytimes Say what you will about @united, but it only took them like four tries over two days to release an apology that<U+2026>",NA,NA,NA
"thank much outstand servic help us rosemari diego ewr airport guy rock","2",0.862982694771072,"@united thank you so much for your outstanding service helping us!! Rosemarie and Diego at EWR Airport, YOU GUYS ROCK!!",-102.4107493,34.2331373,"texas"
"rt today last fli honest felt saw flight almost full tco goweeb","2",0.561405713514131,"RT @manchestergs: Today was my last fly with @united and honestly this is how I felt when I saw the flight almost full https://t.co/GowEe8b<U+2026>",NA,NA,NA
"gate natur tco ehsetddm","1",0.521461120942657,"At a @united gate, naturally https://t.co/EhsET1DDme",-74.0059413,40.7127837,"new york"
"poc tri warn elect well mean white friend said confid noth will chang pse tco ukyrfloh","1",0.976980116357418,"POC tried to warn you. After election well meaning white friends said confidently \"nothing will change\" 

(PS<U+2026> https://t.co/5Uk2yRFLoh",-115.1745559,36.1023715,"nevada"
"pretti sure basic economi famili will ride check luggag tco harzferlk","1",0.514747633503134,"I'm pretty sure with @united basic economy my family and I will be riding with the all of the checked luggage. https://t.co/hArZfe3RLK",-74.4056612,40.0583238,"new jersey"
"mani intox flier allow oboard updat rule","1",0.717040329913616,"@AmericanAir @Delta @united @SouthwestAir @JetBlue too many intoxicated fliers being allowed oboard update the rules.",-74.0059413,40.7127837,"new york"
"time chang rule intox fli mean anybodi buckl seatbelt rebook til sober","2",0.865107576164156,"Time to change the rules too intoxicated to fly means anybody who cannot buckle a seatbelt rebook til sober.  @AmericanAir @Delta @united",-74.0059413,40.7127837,"new york"
"appal new basic economi still pay lot flight amp get flexibl hope yo sit alon","1",0.945756297762086,"Appalled at @united new \"basic economy\".You still pay a lot for a flight &amp; get no flexibility.Let's hope our 3yo doesn't have to sit alone!",-74.4056612,40.0583238,"new jersey"
"need help today flight delay will miss connect","1",0.938724169706917,"@united I need help today--my flight is delayed and I will miss my connection.",-115.1745559,36.1023715,"nevada"
"ughhhhhhh just told us wifi work long haul flight ughhhhhhh saddddd","2",0.893259509156444,"@united UGHHHHHHH they just told us the wifi isn't working on our long haul flight!! UGHHHHHHH I AM SADDDDD",-72.5026249,41.5757748,"connecticut"
"discord chat block flight wifi","1",0.628048647541458,"@united why is discord chat blocked on in flight WiFi?",-74.0059413,40.7127837,"new york"
"schedul plane certain time just readi suppos take still wait min","1",0.984209882359643,"@united why do you schedule planes at certain times just for them to not be ready? Supposed to take off at 6 but i still have to wait 20 min",-74.1371832,40.0578384,"new jersey"
"ma boy edbdedbeedbdedbeedbdedbeedbdedb","2",0.555230829927128,"@jarpad @united MA BOY <ed><U+00A0><U+00BD><ed><U+00B8><U+008E><ed><U+00A0><U+00BD><ed><U+00B8><U+008E><ed><U+00A0><U+00BD><ed><U+00B8><U+008E><ed><U+00A0><U+00BD><ed><U+00B8><U+008E>",-82.9000751,32.1656221,"georgia"
"take anoth l just logo video tco skagjvbji","2",0.644789806097601,": @united is taking another L just for the logo being in the video https://t.co/SKAGJVBJ2Y",NA,NA,NA
"probabl better fli","1",0.611185291132347,"@SpiritAirlines We were probably better off flying @united",-72.7420151,41.7620842,"connecticut"
"asshol dersev seat","2",0.568181102582044,"@ShaunKing This asshole derseves a seat of @united",-74.0059413,40.7127837,"new york"
"s fault time guy everyth wrong america","1",0.533752026731681,"@BillyCorben @united This isn't @united's fault this time, but this guy is everything that's wrong with America.",-74.0059413,40.7127837,"new york"
"get bag flight final land ewr hour suppos said bag still iah","1",0.999585676569447,"@united didn't get my bag on the flight! I finally landed in EWR 7 1/2 hours after I was supposed to and they said my bag is still in IAH!",-74.0323626,40.7439905,"new jersey"
"sent","2",0.569570934990292,"@united It. Has. Been. Sent.",-74.0059413,40.7127837,"new york"
"sent","2",0.569570934990292,"@united Sent it.",-74.0059413,40.7127837,"new york"
"ive spent hour life today iad wait yall keep fuck somehow","1",0.92208872010358,"@united Ive spent 8 hours of my life today at IAD waiting on yall and you keep fucking me somehow.",-74.0059413,40.7127837,"new york"
"whole lot see yoi just cancel flight lga need hotel night can come stay","1",0.99698673800452,"@united A whole lot seeing as how yoi just cancelled my flight to lga and i need a hotel for the night. Can i come stay with you?",-74.0059413,40.7127837,"new york"
"airlin imcompet im","2",0.627445780304237,"@united how is any airline this imcompetent im 2017?",-74.0059413,40.7127837,"new york"
"great job get us board chang rout cancel flight mid taxi wtf wrong guy","1",0.984385896059902,"@united great job getting us all on board, changing our route, and then cancelling the flight mid taxi. Wtf is wrong with you guys?",-74.0059413,40.7127837,"new york"
"unreal six hour delay offer affect passeng joke ua tco wymwiez","1",0.91002000351936,"Unreal @united, six hours delay and you offered the affected passengers $10, this has to be a joke! #UA1066 https://t.co/WyM523wIeZ",-74.0059413,40.7127837,"new york"
"custom servic today bos amp ewr disappoint client respect especi loyal week busi client","1",0.947738486409555,"@united customer service today at BOS &amp; EWR so disappointing. All clients should have more respect, ESPECIALLY loyal WEEKLY business clients",-74.0059413,40.7127837,"new york"
"tonight last night husband hrs may th may th anyway take gotta power ecefbf","1",0.774520464366312,"@united Tonight. And last night for my husband (4 hrs), and May 7th, and May 9th. 
Anyway, taking off. Gotta power down! <U+2708><U+FE0F>",-74.0059413,40.7127837,"new york"
"blame know better ever fli alwaysl threehourdelay andcount tco mkwotheuk","1",0.797317502642541,"I blame myself. I know better than to ever fly with @united....
#ALWAYSlate #ThreeHourDelay #AndCounting https://t.co/MK0WoTHeUK",-74.0059413,40.7127837,"new york"
"take suppos land edbdedbedbdedb greeeattt","1",0.930104276900594,"@united we're taking off when we were supposed to land <ed><U+00A0><U+00BD><ed><U+00B8><U+0091><ed><U+00A0><U+00BD><ed><U+00B8><U+0094> greeeattt",-74.0059413,40.7127837,"new york"
"board suppos land hour ago spent food rental car place close cab destin thank","1",0.82096084774969,"Haven't boarded, was supposed to land an hour ago. 100 spent on food, rental car place closing; $120 cab to destination. Thanks @united",-74.0059413,40.7127837,"new york"
"hour will final home miss wife kid lot thank veeamoff ecefbf ua e tco tjkgtnosm","2",0.86357864133946,"9 hours more and I will FINALLY be at home. Missing my wife and kids a lot. Thanks again @veeam #VeeamOFF <U+2708><U+FE0F>  UA 14<U+2026> https://t.co/Tjkgt3NOsM",NA,NA,NA
"call someth","1",0.809514231316615,"@Delta @united So... should I call or something?",-73.9441579,40.6781784,"new york"
"also sinc feel like respond tri bribe us sy snack gonna work","1",0.882678212234913,"@united Also, since you don't feel like responding, what is with trying to bribe us with s****y snacks? Not gonna work on me.",-74.0059413,40.7127837,"new york"
"passeng ask stay overnight repres shrug say idk","1",0.940401907120206,"Some passengers were asking where they would stay overnight and representatives were shrugging and saying idk @united",-73.9234619,40.7643574,"new york"
"rerout tomorrow morn flight time keep fluctuat cool","2",0.532733439613234,"And we're being rerouted for tomorrow morning but the flight time keeps fluctuating... @united this is not cool",-73.9234619,40.7643574,"new york"
"bump back seat hour flight give advic pleas","1",0.66122708827051,"@JetBlue @Virgin @AlaskaAir @SouthwestAir would you bump me back 10+ seats 24 hours before a flight? @united did. Give them advice please",-74.129032,41.0414857,"new jersey"
"complet status match month ago want get rid tag","1",0.846569070172402,"@Delta I have not. I completed the status match a month ago and want to get rid of my @United tags.",-73.9441579,40.6781784,"new york"
"day paradis ruin bump us back plane reason tco lyqeedj","1",0.760799486954329,"7 days in paradise ruined by @united  because they bumped us to the back of the plane with no reason<U+2026> https://t.co/LYQ65eed2j",-74.129032,41.0414857,"new jersey"
"need talk mess flight home tomorrow","1",0.960204669494242,"@Expedia you need to talk to @united about messing up my flight home tomorrow",-74.129032,41.0414857,"new jersey"
"mani tweet realiz mess unitedairlinesmotto marketingtip unitedsuck","1",0.894594468045418,"How many tweets until @united realizes they messed up? #unitedairlinesmottos #marketingtips  #unitedsucks",-74.129032,41.0414857,"new jersey"
"theori s flight delay newark forc passeng buy overpr dinner beer jkbutonlykinda","1",0.939281234983664,"I have a theory that @united's flight delays at Newark are to force passengers into buying overpriced dinner and $10 beers. #jkbutonlykinda",-122.8755949,42.3265152,"oregon"
"s o make us sit plane readi take two hour cancel flight therealmvp","1",0.963721767105442,"S/o to @united for making us sit on the plane ready to take off for two hours then cancelling the flight #therealmvp",-73.9234619,40.7643574,"new york"
"hi board now tad hrs late kudo better right congrat","1",0.65490357742307,"Hi @AmericanAir we are boarding now.  Tad over 3 hrs late but kudos to you.  Better than @united and @SpiritAirlines, right?  #congrats",-75.1652215,39.9525839,"pennsylvania"
"can someon teach treat custom thank badpr unitedairlinesmotto","2",0.537217937164669,"@JetBlue @Virgin @SouthwestAir @Delta @AlaskaAir can someone teach @united how to treat customers? Thanks! #BadPR #unitedairlinesmottos",-74.129032,41.0414857,"new jersey"
