"text","SVM_LABEL","SVM_PROB","original_text","lon","lat","state"
"thank paid check bag made onto flight neveragain therumorsaretru tco jbsqgaedid","2",0.685275952992947,"Thanks @united paid $220 to check 4 bags of which 0 made it onto our flight #neveragain #therumorsaretrue ... https://t.co/JBsqGAeDId",-74.0059413,40.7127837,"new york"
"rt just absolut fantast went extra mile understand difficult situat help us oe","2",0.710411089561725,"RT @Louisplaysbass: @united They were just absolutely fantastic and went the extra mile to understand our difficult situation and help us o<U+2026>",NA,NA,NA
"hey system show flight close still board group scare saw e tco ztejrylcu","1",0.955700547603128,"Hey @united why does your system show \"flight closed\" when you're still boarding group 4? Scared me when I saw that<U+2026> https://t.co/ZtEJryL4cu",NA,NA,NA
"scream lock awesom","2",0.857985363546046,"@FoxNews @united They all screamed lock him up ! Awesome !",-74.0059413,40.7127837,"new york"
"rt hold custom repres minut just want know can get destin afte","1",0.936461873154011,"RT @BethCorzoDuke: @united been on hold with customer representative for 15 minutes. Just want to know how I can get to my destination afte<U+2026>",-75.4901833,40.6084305,"pennsylvania"
"just absolut fantast went extra mile understand difficult situat help tco btxbjmduu","2",0.769181847241807,"@united They were just absolutely fantastic and went the extra mile to understand our difficult situation and help<U+2026> https://t.co/0bTxBjMdUu",-74.0059413,40.7127837,"new york"
"yes lie treason collus goldman sach big oil cabinet kee tco xcaqyfxhn","1",0.667748075413196,"@WAC_Veteran @joyceburns1 @FoxNews @united Yes! Lying, treason, collusion, a Goldman Sachs/big oil cabinet and a ke<U+2026> https://t.co/xCaQy6FXHN",-74.0059413,40.7127837,"new york"
"reason ua keep get push back","1",0.830128563681372,"@united Any reason why UA6261 keeps getting pushed back?",-74.0059413,40.7127837,"new york"
"fli friend skysedbdedbac","1",0.666253001181096,"@FoxNews @united Fly the friendly sky's!<ed><U+00A0><U+00BD><ed><U+00B8><U+00AC>",-81.5157535,27.6648274,"florida"
"rt man make america great hat kick flight tri steal anoth passeng seat tco e","2",0.55431180684663,"RT @NYDailyNews: Man in \"Make America Great Again\" hat kicked off @United flight for trying to steal another passenger's seat https://t.co/<U+2026>",-74.0059413,40.7127837,"new york"
"rt corpor cultur horribl never fli unit even cost less e","1",0.921914532773757,"RT @IamJohnBurnett: Corporate culture @united is horrible. I'll never fly #united again, even if it cost less @FoxNews @TuckerCarlson @cher<U+2026>",NA,NA,NA
"thought airlin bad tri travel","1",0.795393912627221,"If you thought @united airline was bad, you should try traveling by @GreyhoundBus ...",-74.0059413,40.7127837,"new york"
"print ticket cle appar attach electron ticket reserv board flight home","1",0.790124604633523,".@united printed my ticket to CLE, but apparently didn't attach the electronic ticket to my reservation, so I couldn't board my flight home",-73.9766668,40.7533488,"new york"
"meant vet","1",0.536148784478047,"@WAC_Veteran @54percentWins @FoxNews @united Was not meant for you Vet",-74.0059413,40.7127837,"new york"
"rt thx","2",0.805593643737106,"RT @MissMegLynn13: @united it was thx",NA,NA,NA
"see jerkoff","2",0.713750999463015,"@54percentWins @WAC_Veteran @FoxNews @united I see you're a jerkoff",-74.0059413,40.7127837,"new york"
"assum fan lie pussi grabber chief faux christian well","2",0.576359588105229,"@joyceburns1 @WAC_Veteran @FoxNews @united Assume you're a fan of the lying pussy grabber in chief. Are you a faux Christian as well?",-74.0059413,40.7127837,"new york"
"knew idiot oval offic last year","1",0.622600804316343,"@WrenchSpinRAC @FoxNews @united They knew that from the idiot in the Oval Office for the last 8 years",-74.0059413,40.7127837,"new york"
"rt thank delay flight email back get airport cancel now help hotel next flie","1",0.976990043897492,"RT @AladdinSanes: Thanks @united delay my flight. Email it's back on. Get to airport and it's cancelled. Now no help with hotel or next fli<U+2026>",NA,NA,NA
"luggag damag content soak outsid want end hrs travel tco trxdgbwwsw","1",0.978029818835119,"@united having my luggage damaged and contents soaked (outside and in) isn't how I wanted to end 12 hrs of travel<U+2026> https://t.co/tRXdGBWwSW",-115.1745559,36.1023715,"nevada"
"serious foxnew sometim tabloid stay away junk stori leav cnne tco qxunzb","1",0.721782181664923,"@FoxNews @united Seriously FOXNews sometimes you are so tabloid. Stay away from the junk stories leave that to CNN<U+2026> https://t.co/qx9Un2Z9b7",NA,NA,NA
"freedom speach liberti idea polit affili lefe tco kgxmuqq","1",0.577467386364494,"@FoxNews @united Where is the freedom of speach and the liberty of your own ideas and political affiliation the lef<U+2026> https://t.co/5kGXMu5Q8q",-81.5157535,27.6648274,"florida"
"passeng flight make fli great","1",0.670993306083037,"@NBCNewYork Why can't passengers on all flights be @united, Make Flying Great Again.",-73.9441579,40.6781784,"new york"
"passeng flight make fli great","1",0.670993306083037,"@FoxNews @united Why can't passengers on all flights be @united, Make Flying Great Again.",-73.9441579,40.6781784,"new york"
"worst airlin ever flown delay destin y suck","1",0.959098991560195,"@united is the worst airline I have ever flown. Delays to and from my destination. Y'all suck",-73.7948516,40.7282239,"new york"
"boss came back india flew hr delay gave dollar biz class tick thanksunit","2",0.7722432328458,"My boss came back from India, flew @united. Had a 15hr delay - all they gave him is $400 dollars on an $11,000 biz class tick. #thanksUnited",-74.0059413,40.7127837,"new york"
"hi clark video produc time allow publish video pe tco rfynrlqkiu","2",0.726871910906297,"@clark_gredona @united Hi Clark, I'm a video producer for TIME, would we be allowed to publish your videos on our p<U+2026> https://t.co/rfYNrLQkiU",-74.0059413,40.7127837,"new york"
"get name know histori involv tco xskdfwmft tco oixizrzr","1",0.655713217645891,"How did @United get its name? And did you know is history involves @Boeing? More: https://t.co/xsKdfWM5Ft https://t.co/OIX4iZrz8r",-74.0059413,40.7127837,"new york"
"rt man make america great hat kick flight tri steal anoth passeng seat tco e","2",0.55431180684663,"RT @NYDailyNews: Man in \"Make America Great Again\" hat kicked off @United flight for trying to steal another passenger's seat https://t.co/<U+2026>",-81.0998342,32.0835407,"georgia"
"stupid answer winner","1",0.748842556932663,"@eturner010 @FoxNews @united Stupid answer winner.",-74.0059413,40.7127837,"new york"
"anoth day anoth delay flight water also wet","1",0.945419600796741,"Another day another delayed flight by @united. Water is also wet",-118.2436849,34.0522342,"california"
"unit hire guy caus disrupt make look like passeng bad egg knew e tco nqqkpanemg","1",0.660323798893391,"@FoxNews @united United hired this guy to cause a disruption, make it look like passengers are the bad eggs. Knew i<U+2026> https://t.co/nqQKpANEMg",-74.0059413,40.7127837,"new york"
"perhap cnn will ask sean spicer presid will apolog man behavior just rue tco aftbkhi","2",0.647322797416972,"@FoxNews @united perhaps CNN will ask Sean Spicer if the President will apologize for this mans behavior or just ru<U+2026> https://t.co/1af4TBk3hi",-74.0059413,40.7127837,"new york"
"employe v actual told make one except made except","2",0.512918136018612,"@united employee of v042130 actually told me he could only make one exception for me when he has not made any exceptions!",-73.9712488,40.7830603,"new york"
"brand sock think import","2",0.665478274619061,"@FoxNews @united What brand was his socks? I think it's important.",-73.9441579,40.6781784,"new york"
"hat wear laker hat news","2",0.58278160426944,"@FoxNews @united What does that hat have to do with this?  If he was wearing a Lakers hat would it be news?",-74.4056612,40.0583238,"new jersey"
"expect peopl w maga hat","1",0.751771734346275,"@FoxNews @united this is very expected of people w/ Maga hat!",-74.0059413,40.7127837,"new york"
"rt man make america great hat kick flight tri steal anoth passeng seat tco e","2",0.55431180684663,"RT @NYDailyNews: Man in \"Make America Great Again\" hat kicked off @United flight for trying to steal another passenger's seat https://t.co/<U+2026>",-74.4056612,40.0583238,"new jersey"
"irrelev hat say","1",0.584025180712173,"@marcus_smoot @FoxNews @united all those are irrelevant, the hat says it all",-74.0059413,40.7127837,"new york"
"rt man make america great hat kick flight tri steal anoth passeng seat tco e","2",0.55431180684663,"RT @NYDailyNews: Man in \"Make America Great Again\" hat kicked off @United flight for trying to steal another passenger's seat https://t.co/<U+2026>",-79.9310512,32.7764749,"south carolina"
"put chines prison hour think twice act like old dick","1",0.727474076185255,"@FoxNews @united Should have put him in a Chinese prison for 48 hours.  He'd think twice about acting like an old dick.",-73.9753676,40.7870106,"new york"
"rt man make america great hat kick flight tri steal anoth passeng seat tco e","2",0.55431180684663,"RT @NYDailyNews: Man in \"Make America Great Again\" hat kicked off @United flight for trying to steal another passenger's seat https://t.co/<U+2026>",-73.5876273,40.7556561,"new york"
"lousi servic cane ask help unit point special servic supervisor sat like slug walk gate","1",0.98537812078659,"Lousy service. Have cane. Asked for help. United pointed to special services. They and supervisor sat like slugs. Walked to gate @united",-74.0059413,40.7127837,"new york"
"rt man make america great hat kick flight tri steal anoth passeng seat tco e","2",0.55431180684663,"RT @NYDailyNews: Man in \"Make America Great Again\" hat kicked off @United flight for trying to steal another passenger's seat https://t.co/<U+2026>",-75.7065802,41.3948017,"pennsylvania"
"rt man make america great hat kick flight tri steal anoth passeng seat tco e","2",0.55431180684663,"RT @NYDailyNews: Man in \"Make America Great Again\" hat kicked off @United flight for trying to steal another passenger's seat https://t.co/<U+2026>",NA,NA,NA
"rt man make america great hat kick flight tri steal anoth passeng seat tco e","2",0.55431180684663,"RT @NYDailyNews: Man in \"Make America Great Again\" hat kicked off @United flight for trying to steal another passenger's seat https://t.co/<U+2026>",NA,NA,NA
"believ aw custom servic complet lack respect pax time","1",0.936294910799539,"Can't believe the awful customer service and complete lack of respect for pax time @united",-74.2090053,40.8259007,"new jersey"
"passeng trump hat escort flt escort plane passeng chant eclock ed tco xfhrbxkr","1",0.858736976680391,"Passenger in Trump hat escorted off @United flt: while being escorted from plane, passengers chanted <U+201C>Lock him up!<U+201D> https://t.co/9XfhRBXKr5",-74.0059413,40.7127837,"new york"
"ask rep club repeat plane transit said lie switch altern flight fail","1",0.997917540618585,"asked @united rep at club repeatedly if plane was here or in transit. They said here. LIES. I could have switched to alternate flight #fail",-74.2090053,40.8259007,"new jersey"
"cool thought perk get credit card th birthday cool e tco ozuiirzr","1",0.981540129748254,"Not cool @united. I thought this was a perk of getting your credit card... and it's my 30th birthday. Not cool at a<U+2026> https://t.co/oz4uiI5rzR",-74.9560032,40.7070446,"new jersey"
"provid accur info point today wait ewr delay home fail norespectforpax neveragain","1",0.966814044434837,"If @united had provided accurate info at any point today, I could be waiting out #EWR delay at home #fail #NoRespectforPax #neveragain",-74.2090053,40.8259007,"new jersey"
"rt man make america great hat kick flight tri steal anoth passeng seat tco e","2",0.55431180684663,"RT @NYDailyNews: Man in \"Make America Great Again\" hat kicked off @United flight for trying to steal another passenger's seat https://t.co/<U+2026>",-98.4936282,29.4241219,"texas"
"rt two differ flight delay total time today least violenc thus fare","1",0.845658997059263,"RT @michaeleaves: I've had two different @united flights delayed a total of 4 times today, but at least there's been no violence thus far.<U+2026>",-119.1390642,34.3704884,"california"
"pleas allow chang flight flight less mine without charg enough","2",0.679920093235118,"@united please allow me to change my flight to a flight that's $1,000 less than mine without charging me $450- isn't $550 enough $ for you?",-73.9712488,40.7830603,"new york"
"rt fuck greedi bastard","1",0.705348174460156,"RT @Xonoris: Fuck @united you greedy bastards",NA,NA,NA
"ridicul load peopl plane sit runway confirm departur time","1",0.970874063750208,"@united. Ridiculous that you load people on a plane and have them sit on runway when there is no confirmed departure time.",-74.4056612,40.0583238,"new jersey"
"rt man make america great hat kick flight tri steal anoth passeng seat tco e","2",0.55431180684663,"RT @NYDailyNews: Man in \"Make America Great Again\" hat kicked off @United flight for trying to steal another passenger's seat https://t.co/<U+2026>",-90.043146,29.919489,"louisiana"
"rt man make america great hat kick flight tri steal anoth passeng seat tco e","2",0.55431180684663,"RT @NYDailyNews: Man in \"Make America Great Again\" hat kicked off @United flight for trying to steal another passenger's seat https://t.co/<U+2026>",-90.0715323,29.9510658,"louisiana"
"rt man make america great hat kick flight tri steal anoth passeng seat tco e","2",0.55431180684663,"RT @NYDailyNews: Man in \"Make America Great Again\" hat kicked off @United flight for trying to steal another passenger's seat https://t.co/<U+2026>",-90.0715323,29.9510658,"louisiana"
"passeng flight make fli great tco idszlglnp","1",0.603485011677286,"Why can't passengers on all flights be @united, Make Flying Great Again. https://t.co/IDsZ8LGLNP",-73.9441579,40.6781784,"new york"
"rt two differ flight delay total time today least violenc thus fare","1",0.845658997059263,"RT @michaeleaves: I've had two different @united flights delayed a total of 4 times today, but at least there's been no violence thus far.<U+2026>",NA,NA,NA
"rt man make america great hat kick flight tri steal anoth passeng seat tco e","2",0.55431180684663,"RT @NYDailyNews: Man in \"Make America Great Again\" hat kicked off @United flight for trying to steal another passenger's seat https://t.co/<U+2026>",-119.4179324,36.778261,"california"
"ever get gate logist right gonna late even though land time ugh","1",0.971732487182096,"Why can't @United ever get their gate logistics right?  Gonna be late again even though we landed on time.  Ugh.",-118.2908319,34.0624616,"california"
"rt man make america great hat kick flight tri steal anoth passeng seat tco e","2",0.55431180684663,"RT @NYDailyNews: Man in \"Make America Great Again\" hat kicked off @United flight for trying to steal another passenger's seat https://t.co/<U+2026>",-74.0059413,40.7127837,"new york"
"rt man make america great hat kick flight tri steal anoth passeng seat tco e","2",0.55431180684663,"RT @NYDailyNews: Man in \"Make America Great Again\" hat kicked off @United flight for trying to steal another passenger's seat https://t.co/<U+2026>",NA,NA,NA
"flight delay late take earlier flight solucki","1",0.886172165109173,"@united And flight was further delayed only after it was too late to take the earlier flight! #SoLucky!",-74.4056612,40.0583238,"new jersey"
"rt man make america great hat kick flight tri steal anoth passeng seat tco e","2",0.55431180684663,"RT @NYDailyNews: Man in \"Make America Great Again\" hat kicked off @United flight for trying to steal another passenger's seat https://t.co/<U+2026>",NA,NA,NA
"unitedclub newark none champagn advertis special placard co soda win","2",0.754251259886461,"So @united #UnitedClub in Newark has none of the champagne advertised for a special on placards and has no CO2 for soda. #winning",-74.4056612,40.0583238,"new jersey"
"rt man make america great hat kick flight tri steal anoth passeng seat tco e","2",0.55431180684663,"RT @NYDailyNews: Man in \"Make America Great Again\" hat kicked off @United flight for trying to steal another passenger's seat https://t.co/<U+2026>",-74.0059413,40.7127837,"new york"
"rt man make america great hat kick flight tri steal anoth passeng seat tco e","2",0.55431180684663,"RT @NYDailyNews: Man in \"Make America Great Again\" hat kicked off @United flight for trying to steal another passenger's seat https://t.co/<U+2026>",-94.2088172,36.3728538,"arkansas"
"rt man make america great hat kick flight tri steal anoth passeng seat tco e","2",0.55431180684663,"RT @NYDailyNews: Man in \"Make America Great Again\" hat kicked off @United flight for trying to steal another passenger's seat https://t.co/<U+2026>",-119.4179324,36.778261,"california"
"rt man make america great hat kick flight tri steal anoth passeng seat tco e","2",0.55431180684663,"RT @NYDailyNews: Man in \"Make America Great Again\" hat kicked off @United flight for trying to steal another passenger's seat https://t.co/<U+2026>",-85.6680863,42.9633599,"michigan"
"rt man make america great hat kick flight tri steal anoth passeng seat tco e","2",0.55431180684663,"RT @NYDailyNews: Man in \"Make America Great Again\" hat kicked off @United flight for trying to steal another passenger's seat https://t.co/<U+2026>",NA,NA,NA
"rt man make america great hat kick flight tri steal anoth passeng seat tco e","2",0.55431180684663,"RT @NYDailyNews: Man in \"Make America Great Again\" hat kicked off @United flight for trying to steal another passenger's seat https://t.co/<U+2026>",-74.0059413,40.7127837,"new york"
"rt man make america great hat kick flight tri steal anoth passeng seat tco e","2",0.55431180684663,"RT @NYDailyNews: Man in \"Make America Great Again\" hat kicked off @United flight for trying to steal another passenger's seat https://t.co/<U+2026>",-97.092877,35.0077519,"oklahoma"
"rt man make america great hat kick flight tri steal anoth passeng seat tco e","2",0.55431180684663,"RT @NYDailyNews: Man in \"Make America Great Again\" hat kicked off @United flight for trying to steal another passenger's seat https://t.co/<U+2026>",NA,NA,NA
"rt man make america great hat kick flight tri steal anoth passeng seat tco e","2",0.55431180684663,"RT @NYDailyNews: Man in \"Make America Great Again\" hat kicked off @United flight for trying to steal another passenger's seat https://t.co/<U+2026>",-102.4107493,34.2331373,"texas"
"rt man make america great hat kick flight tri steal anoth passeng seat tco e","2",0.55431180684663,"RT @NYDailyNews: Man in \"Make America Great Again\" hat kicked off @United flight for trying to steal another passenger's seat https://t.co/<U+2026>",NA,NA,NA
"rt man make america great hat kick flight tri steal anoth passeng seat tco e","2",0.55431180684663,"RT @NYDailyNews: Man in \"Make America Great Again\" hat kicked off @United flight for trying to steal another passenger's seat https://t.co/<U+2026>",NA,NA,NA
"rt man make america great hat kick flight tri steal anoth passeng seat tco e","2",0.55431180684663,"RT @NYDailyNews: Man in \"Make America Great Again\" hat kicked off @United flight for trying to steal another passenger's seat https://t.co/<U+2026>",-73.9060579,40.6402325,"new york"
"rt man make america great hat kick flight tri steal anoth passeng seat tco e","2",0.55431180684663,"RT @NYDailyNews: Man in \"Make America Great Again\" hat kicked off @United flight for trying to steal another passenger's seat https://t.co/<U+2026>",NA,NA,NA
"rt man make america great hat kick flight tri steal anoth passeng seat tco e","2",0.55431180684663,"RT @NYDailyNews: Man in \"Make America Great Again\" hat kicked off @United flight for trying to steal another passenger's seat https://t.co/<U+2026>",-122.4194155,37.7749295,"california"
"rt man make america great hat kick flight tri steal anoth passeng seat tco e","2",0.55431180684663,"RT @NYDailyNews: Man in \"Make America Great Again\" hat kicked off @United flight for trying to steal another passenger's seat https://t.co/<U+2026>",NA,NA,NA
"rt man make america great hat kick flight tri steal anoth passeng seat tco e","2",0.55431180684663,"RT @NYDailyNews: Man in \"Make America Great Again\" hat kicked off @United flight for trying to steal another passenger's seat https://t.co/<U+2026>",NA,NA,NA
"rt man make america great hat kick flight tri steal anoth passeng seat tco e","2",0.55431180684663,"RT @NYDailyNews: Man in \"Make America Great Again\" hat kicked off @United flight for trying to steal another passenger's seat https://t.co/<U+2026>",NA,NA,NA
"rt man make america great hat kick flight tri steal anoth passeng seat tco e","2",0.55431180684663,"RT @NYDailyNews: Man in \"Make America Great Again\" hat kicked off @United flight for trying to steal another passenger's seat https://t.co/<U+2026>",NA,NA,NA
"rt man make america great hat kick flight tri steal anoth passeng seat tco e","2",0.55431180684663,"RT @NYDailyNews: Man in \"Make America Great Again\" hat kicked off @United flight for trying to steal another passenger's seat https://t.co/<U+2026>",NA,NA,NA
"rt man make america great hat kick flight tri steal anoth passeng seat tco e","2",0.55431180684663,"RT @NYDailyNews: Man in \"Make America Great Again\" hat kicked off @United flight for trying to steal another passenger's seat https://t.co/<U+2026>",NA,NA,NA
"man make america great hat kick flight tri steal anoth passeng seat tco kuyxnoh","2",0.55431180684663,"Man in \"Make America Great Again\" hat kicked off @United flight for trying to steal another passenger's seat<U+2026> https://t.co/KUyXn6ohlI",-74.0059413,40.7127837,"new york"
"break let passeng fight overbook seat now tco blsokuykl","1",0.721894792610279,"BREAKING: @united letting passengers fight for overbooked seats now https://t.co/blsokuYk3l",-74.7909125,40.2599864,"new jersey"
"two differ flight delay total time today least violenc thus far good edbdedb","1",0.714732782945455,"I've had two different @united flights delayed a total of 4 times today, but at least there's been no violence thus far. So, that's good.. <ed><U+00A0><U+00BD><ed><U+00B8><U+0092>",-72.9492703,41.6717648,"connecticut"
"rt feel pick dad back airport bc flight militari deploy cancel","1",0.913334150490847,"RT @SavannahMiller_: That feeling when you pick your dad BACK up at the airport bc his @united flight for his military DEPLOYMENT is cancel<U+2026>",-102.4107493,34.2331373,"texas"
"lol bc delay flight even hrs take one morn","1",0.920249519422776,"@united Lol bc @united delayed my flight even more (4+ hrs) and had to take one this morning",-74.0059413,40.7127837,"new york"
"airlin mess","1",0.528284600682369,"@united your airline is a mess",-74.4056612,40.0583238,"new jersey"
"flight now six hour delay littl know explan realli good freesnacksdontcutit","1",0.863354567568055,"@united, my flight is now six hours delayed with little to know explanation. What's really good? #FreeSnacksDontCutIt",-74.1181971,42.0409247,"new york"
"flight madison wi cancel okayemilwauke drive madison sure flight milwauke cancel thank","1",0.89141536801701,"[Flight to Madison, WI: Cancelled]

Okay<U+2026>Milwaukee and drive to Madison then? Sure.

[Flight to Milwaukee: Cancelled]

Thanks, @United.",-74.4243178,40.4959379,"new jersey"
"es kind unreal really","2",0.584221217509789,"@united It<U+2019>s kind of unreal really<U+2026>",-74.4056612,40.0583238,"new jersey"
"delay flight now wait line sole employe purchas seat upgrad","1",0.90174285492484,"@united by delaying my flight but now I have to wait in a line for  your sole employee to purchase a $49 seat upgrade?",-74.4056612,40.0583238,"new jersey"
"telephon custom servic unabl process upgrad gate control eve alreadi inconvenienc","1",0.829991533239617,"@united and your telephone customer service is unable to process my upgrade because the gate has control. You<U+2019>ve already inconvenienced me",-74.4056612,40.0583238,"new jersey"
"want spend money eservice app wonet accept seat upgrad gate staff member people","1",0.981523060984437,"@united I want to spend my money on your <U+2018>service<U+2019> but your app won<U+2019>t accept my seat upgrade, your gate has 1 staff member for 15 people<U+2026>",-74.4056612,40.0583238,"new jersey"
"forc check brand new bag paid carri come back like tco qxhqdl","1",0.715419509367875,"When @united forces you to check your brand new bag (that you paid to carry on) and it comes back like this. https://t.co/6q0X6HqD2l",-74.0059413,40.7127837,"new york"
"ua suppos leav final found plane now sit plane wait atc due weather ewr","1",0.994400890504713,"UA 1563 was supposed to leave at 5:10. Finally found the plane, now sitting in plane waiting 4 ATC due 2 weather. @united #ewr",-74.4056612,40.0583238,"new jersey"
"feel pick dad back airport bc flight militari deploy cancel unitedsuck","1",0.945154780502166,"That feeling when you pick your dad BACK up at the airport bc his @united flight for his military DEPLOYMENT is cancelled #unitedsucks",-74.0059413,40.7127837,"new york"
"rt oh disappoint","1",0.791888766628068,"RT @jayft: Oh, @united why do you disappoint me again?",NA,NA,NA
"report gothamist work stori wonder free e tco kcgcyrliy","2",0.730071816409885,"@clark_gredona @united I'm a reporter at Gothamist working on a story about this. I was wondering if you're free to<U+2026> https://t.co/kcGCYRLi6Y",-73.9441579,40.6781784,"new york"
"rt grate","2",0.776013760538116,"RT @mooreish_: How grateful are @pepsi for @united ?",NA,NA,NA
